### ISSUE TITLE
Cannot connect to Agent Gateway with Java MCP client using SSE

### ISSUE THREAD

**Issue by murphye** [agentproxy-dev/agentproxy#166]
I have a problem connecting Java MCP client to Agent Gateway using SSE.

The official MCP Java client sets an `Accept` header of `text/event-stream`. 

```java
			HttpRequest request = requestBuilder.copy()
				.uri(Utils.resolveUri(this.baseUri, this.sseEndpoint))
				.header("Accept", "text/event-stream")
				.header("Cache-Control", "no-cache")
				.GET()
				.build();

```
https://github.com/modelcontextprotocol/java-sdk/blob/main/mcp/src/main/java/io/modelcontextprotocol/client/transport/HttpClientSseClientTransport.java#L331

When I try to connect the client to the Agent Gateway, I get a `406` , as there is not `application/json` as an `Accept` header:

```
406 - Not Acceptable: Client must accept both application/json and text/event-stream
```

Full error:

```
ERROR i.m.c.t.HttpClientSseClientTransport - Error sending message: Sending message failed with a non-OK HTTP code: 406 - Not Acceptable: Client must accept both application/json and text/event-stream
```

For my client configuration, here is my MCP Client settings:

```
spring.ai.mcp.client.sse.connections[server1].url: http://localhost:3000
spring.ai.mcp.client.sse.connections[server1].sse-endpoint: /sse
```

It seems that Agent Gateway should only check for `text/event-stream` to support official MCP clients?

If it helps, here is my config:

```yaml
binds:
  - port: 3000
    listeners:
      - routes:
          - backends:
              - mcp:
                  name: default
                  targets:
                    - name: jokes-service
                      sse:
                        host: jokes-service
                        port: 8080
                        path: /sse
```

**Comment by howardjohn** [comment]
Hmm, so agentgateway servers /sse (SSE) and /mcp (streamable HTTP). The linked code seems to be around an SSE client, and the log suggests `/sse` as well.

But the error `406 - Not Acceptable: Client must accept both application/json and text/event-stream` should only come from using streamable HTTP (/mcp) which is a bit confusing to me...?

**Comment by howardjohn** [comment]
And with the streamable HTTP they do seem to set it properly: https://github.com/modelcontextprotocol/java-sdk/blob/333a60b37e9f0c79ab1946f7ba4bed1b07a8c353/mcp/src/main/java/io/modelcontextprotocol/client/transport/HttpClientStreamableHttpTransport.java#L361.

It seems like there is some weird mixing going on here somehow?

**Comment by murphye** [comment]
The current Spring MCP client does not even (yet) support streamable. But, yes, the thought cross my mind in somehow there is some endpoint routing issue.

Can I turn on some debug from the Gateway side to see the incoming requests?

**Comment by howardjohn** [comment]
RUST_LOG=trace can turn on very verbose logs but it doesn't given exactly what I would want here (dump the entire request and headers); I plan to add such a dump in the future. Good old tcpdump works well as well: ` sudo tcpdump -vnlA -i any port 3000`

**Comment by murphye** [comment]
There seems to be a `sessionId` being passed in an SSE chunk:

```
event: endpoint
data: ?sessionId=27b4bb0b-c041-4f66-bcff-87fd9d24025c
```

Then the Java MCP/HttpClient  is sending a `POST`:

```
POST /?sessionId=27b4bb0b-c041-4f66-bcff-87fd9d24025c HTTP/1.1
Connection: Upgrade, HTTP2-Settings
Content-Length: 190
Host: localhost:3000
HTTP2-Settings: AAEAAEAAAAIAAAAAAAMAAAAAAAQBAAAAAAUAAEAAAAYABgAA
Upgrade: h2c
User-Agent: Java-http-client/24.0.1
Content-Type: application/json
```

This is when the `406 Not Acceptable` actually happens. 

I don't know what to make of this, as I am not an MCP expert :-) 

```
    127.0.0.1.56994 > 127.0.0.1.3000: Flags [P.], cksum 0xff41 (incorrect -> 0xef11), seq 1:282, ack 1, win 6380, options [nop,nop,TS val 3933654550 ecr 4130795501], length 281
E..M..@.@.................Yz.".d.....A.....
.v...6..GET /sse HTTP/1.1
Connection: Upgrade, HTTP2-Settings
Host: localhost:3000
HTTP2-Settings: AAEAAEAAAAIAAAAAAAMAAAAAAAQBAAAAAAUAAEAAAAYABgAA
Upgrade: h2c
User-Agent: Java-http-client/24.0.1
Accept: text/event-stream
Cache-Control: no-cache
Content-Type: application/json


11:40:49.286202 IP (tos 0x0, ttl 64, id 0, offset 0, flags [DF], proto TCP (6), length 333, bad cksum 0 (->3ba9)!)
    127.0.0.1.56994 > 127.0.0.1.3000: Flags [P.], cksum 0xff41 (incorrect -> 0xef11), seq 1:282, ack 1, win 6380, options [nop,nop,TS val 3933654550 ecr 4130795501], length 281
E..M..@.@.................Yz.".d.....A.....
.v...6..GET /sse HTTP/1.1
Connection: Upgrade, HTTP2-Settings
Host: localhost:3000
HTTP2-Settings: AAEAAEAAAAIAAAAAAAMAAAAAAAQBAAAAAAUAAEAAAAYABgAA
Upgrade: h2c
User-Agent: Java-http-client/24.0.1
Accept: text/event-stream
Cache-Control: no-cache
Content-Type: application/json


11:40:49.286274 IP (tos 0x0, ttl 64, id 0, offset 0, flags [DF], proto TCP (6), length 52, bad cksum 0 (->3cc2)!)
    127.0.0.1.3000 > 127.0.0.1.56994: Flags [.], cksum 0xfe28 (incorrect -> 0xd4f4), ack 282, win 6376, options [nop,nop,TS val 4130795526 ecr 3933654550], length 0
E..4..@.@................".d..Z......(.....
.6...v..
11:40:49.286304 IP (tos 0x0, ttl 64, id 0, offset 0, flags [DF], proto TCP (6), length 52, bad cksum 0 (->3cc2)!)
    127.0.0.1.3000 > 127.0.0.1.56994: Flags [.], cksum 0xfe28 (incorrect -> 0xd4f4), ack 282, win 6376, options [nop,nop,TS val 4130795526 ecr 3933654550], length 0
E..4..@.@................".d..Z......(.....
.6...v..
11:40:49.294032 IP (tos 0x0, ttl 64, id 0, offset 0, flags [DF], proto TCP (6), length 271, bad cksum 0 (->3be7)!)
    127.0.0.1.3000 > 127.0.0.1.56994: Flags [P.], cksum 0xff03 (incorrect -> 0x346b), seq 1:220, ack 282, win 6376, options [nop,nop,TS val 4130795534 ecr 3933654550], length 219
E.....@.@................".d..Z............
.6...v..HTTP/1.1 200 OK
content-type: text/event-stream
cache-control: no-cache
transfer-encoding: chunked
date: Tue, 15 Jul 2025 18:40:49 GMT

47
event: endpoint
data: ?sessionId=27b4bb0b-c041-4f66-bcff-87fd9d24025c



11:40:49.294074 IP (tos 0x0, ttl 64, id 0, offset 0, flags [DF], proto TCP (6), length 271, bad cksum 0 (->3be7)!)
    127.0.0.1.3000 > 127.0.0.1.56994: Flags [P.], cksum 0xff03 (incorrect -> 0x346b), seq 1:220, ack 282, win 6376, options [nop,nop,TS val 4130795534 ecr 3933654550], length 219
E.....@.@................".d..Z............
.6...v..HTTP/1.1 200 OK
content-type: text/event-stream
cache-control: no-cache
transfer-encoding: chunked
date: Tue, 15 Jul 2025 18:40:49 GMT

47
event: endpoint
data: ?sessionId=27b4bb0b-c041-4f66-bcff-87fd9d24025c



11:40:49.294126 IP (tos 0x0, ttl 64, id 0, offset 0, flags [DF], proto TCP (6), length 52, bad cksum 0 (->3cc2)!)
    127.0.0.1.56994 > 127.0.0.1.3000: Flags [.], cksum 0xfe28 (incorrect -> 0xd408), ack 220, win 6377, options [nop,nop,TS val 3933654558 ecr 4130795534], length 0
E..4..@.@.................Z..".?.....(.....
.v...6..
11:40:49.294144 IP (tos 0x0, ttl 64, id 0, offset 0, flags [DF], proto TCP (6), length 52, bad cksum 0 (->3cc2)!)
    127.0.0.1.56994 > 127.0.0.1.3000: Flags [.], cksum 0xfe28 (incorrect -> 0xd408), ack 220, win 6377, options [nop,nop,TS val 3933654558 ecr 4130795534], length 0
E..4..@.@.................Z..".?.....(.....
.v...6..
11:40:49.751474 IP (tos 0x0, ttl 64, id 0, offset 0, flags [DF], proto TCP (6), length 64, bad cksum 0 (->3cb6)!)
    127.0.0.1.56995 > 127.0.0.1.3000: Flags [S], cksum 0xfe34 (incorrect -> 0x81ee), seq 255718144, win 65535, options [mss 16344,nop,wscale 6,nop,nop,TS val 3937904021 ecr 0,sackOK,eol], length 0
E..@..@.@................=...........4....?........
............
11:40:49.751489 IP (tos 0x0, ttl 64, id 0, offset 0, flags [DF], proto TCP (6), length 64, bad cksum 0 (->3cb6)!)
    127.0.0.1.56995 > 127.0.0.1.3000: Flags [S], cksum 0xfe34 (incorrect -> 0x81ee), seq 255718144, win 65535, options [mss 16344,nop,wscale 6,nop,nop,TS val 3937904021 ecr 0,sackOK,eol], length 0
E..@..@.@................=...........4....?........
............
11:40:49.751579 IP (tos 0x0, ttl 64, id 0, offset 0, flags [DF], proto TCP (6), length 64, bad cksum 0 (->3cb6)!)
    127.0.0.1.3000 > 127.0.0.1.56995: Flags [S.], cksum 0xfe34 (incorrect -> 0xd852), seq 3037947426, ack 255718145, win 65535, options [mss 16344,nop,wscale 6,nop,nop,TS val 371947561 ecr 3937904021,sackOK,eol], length 0
E..@..@.@.................f".=.......4....?........
.+x)........
11:40:49.751588 IP (tos 0x0, ttl 64, id 0, offset 0, flags [DF], proto TCP (6), length 64, bad cksum 0 (->3cb6)!)
    127.0.0.1.3000 > 127.0.0.1.56995: Flags [S.], cksum 0xfe34 (incorrect -> 0xd852), seq 3037947426, ack 255718145, win 65535, options [mss 16344,nop,wscale 6,nop,nop,TS val 371947561 ecr 3937904021,sackOK,eol], length 0
E..@..@.@.................f".=.......4....?........
.+x)........
11:40:49.751608 IP (tos 0x0, ttl 64, id 0, offset 0, flags [DF], proto TCP (6), length 52, bad cksum 0 (->3cc2)!)
    127.0.0.1.56995 > 127.0.0.1.3000: Flags [.], cksum 0xfe28 (incorrect -> 0x395b), ack 1, win 6380, options [nop,nop,TS val 3937904021 ecr 371947561], length 0
E..4..@.@................=....f#.....(.....
.....+x)
11:40:49.751612 IP (tos 0x0, ttl 64, id 0, offset 0, flags [DF], proto TCP (6), length 52, bad cksum 0 (->3cc2)!)
    127.0.0.1.56995 > 127.0.0.1.3000: Flags [.], cksum 0xfe28 (incorrect -> 0x395b), ack 1, win 6380, options [nop,nop,TS val 3937904021 ecr 371947561], length 0
E..4..@.@................=....f#.....(.....
.....+x)
11:40:49.751629 IP (tos 0x0, ttl 64, id 0, offset 0, flags [DF], proto TCP (6), length 52, bad cksum 0 (->3cc2)!)
    127.0.0.1.3000 > 127.0.0.1.56995: Flags [.], cksum 0xfe28 (incorrect -> 0x395b), ack 1, win 6380, options [nop,nop,TS val 371947561 ecr 3937904021], length 0
E..4..@.@.................f#.=.......(.....
.+x)....
11:40:49.751632 IP (tos 0x0, ttl 64, id 0, offset 0, flags [DF], proto TCP (6), length 52, bad cksum 0 (->3cc2)!)
    127.0.0.1.3000 > 127.0.0.1.56995: Flags [.], cksum 0xfe28 (incorrect -> 0x395b), ack 1, win 6380, options [nop,nop,TS val 371947561 ecr 3937904021], length 0
E..4..@.@.................f#.=.......(.....
.+x)....
11:40:49.754055 IP (tos 0x0, ttl 64, id 0, offset 0, flags [DF], proto TCP (6), length 347, bad cksum 0 (->3b9b)!)
    127.0.0.1.56995 > 127.0.0.1.3000: Flags [P.], cksum 0xff4f (incorrect -> 0x5a85), seq 1:296, ack 1, win 6380, options [nop,nop,TS val 3937904024 ecr 371947561], length 295
E..[..@.@................=....f#.....O.....
.....+x)POST /?sessionId=27b4bb0b-c041-4f66-bcff-87fd9d24025c HTTP/1.1
Connection: Upgrade, HTTP2-Settings
Content-Length: 190
Host: localhost:3000
HTTP2-Settings: AAEAAEAAAAIAAAAAAAMAAAAAAAQBAAAAAAUAAEAAAAYABgAA
Upgrade: h2c
User-Agent: Java-http-client/24.0.1
Content-Type: application/json


11:40:49.754092 IP (tos 0x0, ttl 64, id 0, offset 0, flags [DF], proto TCP (6), length 347, bad cksum 0 (->3b9b)!)
    127.0.0.1.56995 > 127.0.0.1.3000: Flags [P.], cksum 0xff4f (incorrect -> 0x5a85), seq 1:296, ack 1, win 6380, options [nop,nop,TS val 3937904024 ecr 371947561], length 295
E..[..@.@................=....f#.....O.....
.....+x)POST /?sessionId=27b4bb0b-c041-4f66-bcff-87fd9d24025c HTTP/1.1
Connection: Upgrade, HTTP2-Settings
Content-Length: 190
Host: localhost:3000
HTTP2-Settings: AAEAAEAAAAIAAAAAAAMAAAAAAAQBAAAAAAUAAEAAAAYABgAA
Upgrade: h2c
User-Agent: Java-http-client/24.0.1
Content-Type: application/json


11:40:49.754126 IP (tos 0x0, ttl 64, id 0, offset 0, flags [DF], proto TCP (6), length 52, bad cksum 0 (->3cc2)!)
    127.0.0.1.3000 > 127.0.0.1.56995: Flags [.], cksum 0xfe28 (incorrect -> 0x3832), ack 296, win 6376, options [nop,nop,TS val 371947564 ecr 3937904024], length 0
E..4..@.@.................f#.=.(.....(.....
.+x,....
11:40:49.754140 IP (tos 0x0, ttl 64, id 0, offset 0, flags [DF], proto TCP (6), length 52, bad cksum 0 (->3cc2)!)
    127.0.0.1.3000 > 127.0.0.1.56995: Flags [.], cksum 0xfe28 (incorrect -> 0x3832), ack 296, win 6376, options [nop,nop,TS val 371947564 ecr 3937904024], length 0
E..4..@.@.................f#.=.(.....(.....
.+x,....
11:40:49.754293 IP (tos 0x0, ttl 64, id 0, offset 0, flags [DF], proto TCP (6), length 242, bad cksum 0 (->3c04)!)
    127.0.0.1.56995 > 127.0.0.1.3000: Flags [P.], cksum 0xfee6 (incorrect -> 0x4e38), seq 296:486, ack 1, win 6380, options [nop,nop,TS val 3937904024 ecr 371947564], length 190
E.....@.@................=.(..f#...........
.....+x,{"jsonrpc":"2.0","method":"initialize","id":"40bb7de4-0","params":{"protocolVersion":"2024-11-05","capabilities":{},"clientInfo":{"name":"spring-ai-mcp-client - server1","version":"1.0.0"}}}
11:40:49.754331 IP (tos 0x0, ttl 64, id 0, offset 0, flags [DF], proto TCP (6), length 242, bad cksum 0 (->3c04)!)
    127.0.0.1.56995 > 127.0.0.1.3000: Flags [P.], cksum 0xfee6 (incorrect -> 0x4e38), seq 296:486, ack 1, win 6380, options [nop,nop,TS val 3937904024 ecr 371947564], length 190
E.....@.@................=.(..f#...........
.....+x,{"jsonrpc":"2.0","method":"initialize","id":"40bb7de4-0","params":{"protocolVersion":"2024-11-05","capabilities":{},"clientInfo":{"name":"spring-ai-mcp-client - server1","version":"1.0.0"}}}
11:40:49.754367 IP (tos 0x0, ttl 64, id 0, offset 0, flags [DF], proto TCP (6), length 52, bad cksum 0 (->3cc2)!)
    127.0.0.1.3000 > 127.0.0.1.56995: Flags [.], cksum 0xfe28 (incorrect -> 0x3776), ack 486, win 6374, options [nop,nop,TS val 371947564 ecr 3937904024], length 0
E..4..@.@.................f#.=.......(.....
.+x,....
11:40:49.754376 IP (tos 0x0, ttl 64, id 0, offset 0, flags [DF], proto TCP (6), length 52, bad cksum 0 (->3cc2)!)
    127.0.0.1.3000 > 127.0.0.1.56995: Flags [.], cksum 0xfe28 (incorrect -> 0x3776), ack 486, win 6374, options [nop,nop,TS val 371947564 ecr 3937904024], length 0
E..4..@.@.................f#.=.......(.....
.+x,....
11:40:49.756011 IP (tos 0x0, ttl 64, id 0, offset 0, flags [DF], proto TCP (6), length 218, bad cksum 0 (->3c1c)!)
    127.0.0.1.3000 > 127.0.0.1.56995: Flags [P.], cksum 0xfece (incorrect -> 0x599c), seq 1:167, ack 486, win 6374, options [nop,nop,TS val 371947566 ecr 3937904024], length 166
E.....@.@.................f#.=.............
.+x.....HTTP/1.1 406 Not Acceptable
content-length: 78
date: Tue, 15 Jul 2025 18:40:49 GMT

Not Acceptable: Client must accept both application/json and text/event-stream
11:40:49.756029 IP (tos 0x0, ttl 64, id 0, offset 0, flags [DF], proto TCP (6), length 218, bad cksum 0 (->3c1c)!)
    127.0.0.1.3000 > 127.0.0.1.56995: Flags [P.], cksum 0xfece (incorrect -> 0x599c), seq 1:167, ack 486, win 6374, options [nop,nop,TS val 371947566 ecr 3937904024], length 166
E.....@.@.................f#.=.............
.+x.....HTTP/1.1 406 Not Acceptable
content-length: 78
date: Tue, 15 Jul 2025 18:40:49 GMT

Not Acceptable: Client must accept both application/json and text/event-stream
11:40:49.756051 IP (tos 0x0, ttl 64, id 0, offset 0, flags [DF], proto TCP (6), length 52, bad cksum 0 (->3cc2)!)
    127.0.0.1.56995 > 127.0.0.1.3000: Flags [.], cksum 0xfe28 (incorrect -> 0x36c8), ack 167, win 6378, options [nop,nop,TS val 3937904026 ecr 371947566], length 0
E..4..@.@................=....f......(.....
```

**Comment by howardjohn** [comment]
The python, typescript, and rust SDK will treat that as /sse?sessionId=... so the java one differs. The spec is somewhat vague here. 

it's probably safest for us to return the full url (with /sse) for full compatibility I guess

**Comment by christian-posta** [comment]
is this something we could knock out? i don't want to block any java/spring users, that's a big contingent of MCP users.

**Comment by christian-posta** [comment]
@murphye if you have a quick reproducer, i'd love to take a look too

**Comment by murphye** [comment]
Demo project. Requires OpenAI key
https://github.com/murphye/mcp-agentgateway-spring-ai-demo

You need to change the MCP endpoint here to point to agentgateway
(uncomment and comment the other ones out)

https://github.com/murphye/mcp-agentgateway-spring-ai-demo/blob/main/chat-mcp-client/src/main/resources/application.properties#L12

**Comment by howardjohn** [comment]
Sorry for the delay here. Whilethis is a bug in the spring sdk I did implement a workaround. Note I couldn't 100% test it since I couldn't build your example; thanks for sharing it though!

**Comment by howardjohn** [comment]
https://github.com/agentgateway/agentgateway/pull/455

**Comment by murphye** [comment]
@howardjohn I verified this SSE issue is fixed. Thanks! 

I assume there is no intent to support `MCP-Protocol-Version: 2024-11-05` with agentgateway?

Surprisingly Java MCP Client is still stuck on this older version resulting in `Unsupported protocol version` error.

https://github.com/modelcontextprotocol/java-sdk/issues/398
https://github.com/spring-projects/spring-ai/issues/3301

**Comment by murphye** [comment]
Just to close the loop on this, I was able to avoid the MCP version issue by using Streamable HTTP MCP client in Spring AI.

```
spring.ai.mcp.client.streamable-http.connections.server1.url: http://localhost:3000
spring.ai.mcp.client.streamable-http.connections.server1.endpoint: /mcp
```

It seems that the legacy SSE MCP Client is still using the old MCP Version.
