### ISSUE TITLE
Playground Run Tool Fails "Failed to build request: invalid authority"

### ISSUE THREAD

**Issue by murphye** [agentproxy-dev/agentproxy#377]
I am testing `agentgateway` locally with version 0.7.7.

I am having an error `Failed to build request: invalid authority` with the Playground running a tool. Here are the logs and TCP Dump:

```
2025-08-25T18:32:30.429061Z     info    request gateway=bind/3000 listener=mcp-server route_rule=mcp-route/default route=mcp-route src.addr=127.0.0.1:50823 http.method=OPTIONS http.host=localhost http.path=/sse http.version=HTTP/1.1 http.status=200 duration=0ms
2025-08-25T18:32:30.429749Z     info    mcp::sse        new client message for /sse     session_id="e5118cfa-05db-46cb-b66b-ed3c68ab5955"Request(JsonRpcRequest { jsonrpc: JsonRpcVersion2_0, id: Number(3), request: CallToolRequest(Request { method: CallToolRequestMethod, params: CallToolRequestParam { name: "accounts-api_getUserById", arguments: Some({"path": Object {"id": String("1")}}) }, extensions: Extensions }) })
2025-08-25T18:32:30.429789Z     info    request gateway=bind/3000 listener=mcp-server route_rule=mcp-route/default route=mcp-route src.addr=127.0.0.1:50824 http.method=POST http.host=localhost http.path=/sse http.version=HTTP/1.1 http.status=202 duration=0ms
2025-08-25T18:32:30.429899Z     warn    rmcp::service   response error  id=3 error=ErrorData { code: ErrorCode(-32603), message: "Failed to build request: invalid authority", data: None }
```

```
sudo tcpdump -vnlA -i any port 3000
Password:
tcpdump: data link type PKTAP
tcpdump: listening on any, link-type PKTAP (Apple DLT_PKTAP), snapshot length 524288 bytes
12:28:42.818575 IP (tos 0x0, ttl 64, id 0, offset 0, flags [DF], proto TCP (6), length 627, bad cksum 0 (->3a83)!)
    127.0.0.1.51473 > 127.0.0.1.3000: Flags [P.], cksum 0x0068 (incorrect -> 0xa90d), seq 3571352815:3571353390, ack 2996262603, win 6362, options [nop,nop,TS val 2908235222 ecr 84110822], length 575
E..s..@.@.....................V......h.....
.X%...m.OPTIONS /sse?sessionId=3225e539-99c3-49d0-92db-945059223cee HTTP/1.1
Host: localhost:3000
User-Agent: Mozilla/5.0 (Macintosh; Intel Mac OS X 10.15; rv:142.0) Gecko/20100101 Firefox/142.0
Accept: */*
Accept-Language: en-US,en;q=0.5
Accept-Encoding: gzip, deflate, br, zstd
Access-Control-Request-Method: POST
Access-Control-Request-Headers: cache-control,content-type,mcp-protocol-version
Referer: http://localhost:15000/
Origin: http://localhost:15000
Connection: keep-alive
Sec-Fetch-Dest: empty
Sec-Fetch-Mode: cors
Sec-Fetch-Site: same-site
Priority: u=4


12:28:42.818609 IP (tos 0x0, ttl 64, id 0, offset 0, flags [DF], proto TCP (6), length 627, bad cksum 0 (->3a83)!)
    127.0.0.1.51473 > 127.0.0.1.3000: Flags [P.], cksum 0x0068 (incorrect -> 0xa90d), seq 0:575, ack 1, win 6362, options [nop,nop,TS val 2908235222 ecr 84110822], length 575
E..s..@.@.....................V......h.....
.X%...m.OPTIONS /sse?sessionId=3225e539-99c3-49d0-92db-945059223cee HTTP/1.1
Host: localhost:3000
User-Agent: Mozilla/5.0 (Macintosh; Intel Mac OS X 10.15; rv:142.0) Gecko/20100101 Firefox/142.0
Accept: */*
Accept-Language: en-US,en;q=0.5
Accept-Encoding: gzip, deflate, br, zstd
Access-Control-Request-Method: POST
Access-Control-Request-Headers: cache-control,content-type,mcp-protocol-version
Referer: http://localhost:15000/
Origin: http://localhost:15000
Connection: keep-alive
Sec-Fetch-Dest: empty
Sec-Fetch-Mode: cors
Sec-Fetch-Site: same-site
Priority: u=4


12:28:42.818641 IP (tos 0x0, ttl 64, id 0, offset 0, flags [DF], proto TCP (6), length 52, bad cksum 0 (->3cc2)!)
    127.0.0.1.3000 > 127.0.0.1.51473: Flags [.], cksum 0xfe28 (incorrect -> 0xd024), ack 575, win 6292, options [nop,nop,TS val 84114838 ecr 2908235222], length 0
E..4..@.@.................V..........(.....
..}..X%.
12:28:42.818672 IP (tos 0x0, ttl 64, id 0, offset 0, flags [DF], proto TCP (6), length 52, bad cksum 0 (->3cc2)!)
    127.0.0.1.3000 > 127.0.0.1.51473: Flags [.], cksum 0xfe28 (incorrect -> 0xd024), ack 575, win 6292, options [nop,nop,TS val 84114838 ecr 2908235222], length 0
E..4..@.@.................V..........(.....
..}..X%.
12:28:42.819009 IP (tos 0x0, ttl 64, id 0, offset 0, flags [DF], proto TCP (6), length 213, bad cksum 0 (->3c21)!)
    127.0.0.1.3000 > 127.0.0.1.51473: Flags [P.], cksum 0xfec9 (incorrect -> 0x6cee), seq 1:162, ack 575, win 6292, options [nop,nop,TS val 84114838 ecr 2908235222], length 161
E.....@.@.................V................
..}..X%.HTTP/1.1 200 OK
access-control-allow-origin: http://localhost:15000
access-control-allow-headers: *
content-length: 0
date: Mon, 25 Aug 2025 19:28:42 GMT


12:28:42.819031 IP (tos 0x0, ttl 64, id 0, offset 0, flags [DF], proto TCP (6), length 213, bad cksum 0 (->3c21)!)
    127.0.0.1.3000 > 127.0.0.1.51473: Flags [P.], cksum 0xfec9 (incorrect -> 0x6cee), seq 1:162, ack 575, win 6292, options [nop,nop,TS val 84114838 ecr 2908235222], length 161
E.....@.@.................V................
..}..X%.HTTP/1.1 200 OK
access-control-allow-origin: http://localhost:15000
access-control-allow-headers: *
content-length: 0
date: Mon, 25 Aug 2025 19:28:42 GMT


12:28:42.819047 IP (tos 0x0, ttl 64, id 0, offset 0, flags [DF], proto TCP (6), length 52, bad cksum 0 (->3cc2)!)
    127.0.0.1.51473 > 127.0.0.1.3000: Flags [.], cksum 0xfe28 (incorrect -> 0xcf3f), ack 162, win 6360, options [nop,nop,TS val 2908235222 ecr 84114838], length 0
E..4..@.@.....................Wl.....(.....
.X%...}.
12:28:42.819052 IP (tos 0x0, ttl 64, id 0, offset 0, flags [DF], proto TCP (6), length 52, bad cksum 0 (->3cc2)!)
    127.0.0.1.51473 > 127.0.0.1.3000: Flags [.], cksum 0xfe28 (incorrect -> 0xcf3f), ack 162, win 6360, options [nop,nop,TS val 2908235222 ecr 84114838], length 0
E..4..@.@.....................Wl.....(.....
.X%...}.
12:28:42.819530 IP (tos 0x0, ttl 64, id 0, offset 0, flags [DF], proto TCP (6), length 763, bad cksum 0 (->39fb)!)
    127.0.0.1.51473 > 127.0.0.1.3000: Flags [P.], cksum 0x00f0 (incorrect -> 0x97c1), seq 575:1286, ack 162, win 6360, options [nop,nop,TS val 2908235222 ecr 84114838], length 711
E.....@.@.....................Wl...........
.X%...}.POST /sse?sessionId=3225e539-99c3-49d0-92db-945059223cee HTTP/1.1
Host: localhost:3000
User-Agent: Mozilla/5.0 (Macintosh; Intel Mac OS X 10.15; rv:142.0) Gecko/20100101 Firefox/142.0
Accept: text/event-stream
Accept-Language: en-US,en;q=0.5
Accept-Encoding: gzip, deflate, br, zstd
Referer: http://localhost:15000/
cache-control: no-cache
content-type: application/json
mcp-protocol-version: 2024-11-05
Content-Length: 131
Origin: http://localhost:15000
Connection: keep-alive
Sec-Fetch-Dest: empty
Sec-Fetch-Mode: cors
Sec-Fetch-Site: same-site
Priority: u=0

{"method":"tools/call","params":{"name":"inventory-api_getInventoryByUpc","arguments":{"path":{"upc":"1"}}},"jsonrpc":"2.0","id":3}
12:28:42.819545 IP (tos 0x0, ttl 64, id 0, offset 0, flags [DF], proto TCP (6), length 763, bad cksum 0 (->39fb)!)
    127.0.0.1.51473 > 127.0.0.1.3000: Flags [P.], cksum 0x00f0 (incorrect -> 0x97c1), seq 575:1286, ack 162, win 6360, options [nop,nop,TS val 2908235222 ecr 84114838], length 711
E.....@.@.....................Wl...........
.X%...}.POST /sse?sessionId=3225e539-99c3-49d0-92db-945059223cee HTTP/1.1
Host: localhost:3000
User-Agent: Mozilla/5.0 (Macintosh; Intel Mac OS X 10.15; rv:142.0) Gecko/20100101 Firefox/142.0
Accept: text/event-stream
Accept-Language: en-US,en;q=0.5
Accept-Encoding: gzip, deflate, br, zstd
Referer: http://localhost:15000/
cache-control: no-cache
content-type: application/json
mcp-protocol-version: 2024-11-05
Content-Length: 131
Origin: http://localhost:15000
Connection: keep-alive
Sec-Fetch-Dest: empty
Sec-Fetch-Mode: cors
Sec-Fetch-Site: same-site
Priority: u=0

{"method":"tools/call","params":{"name":"inventory-api_getInventoryByUpc","arguments":{"path":{"upc":"1"}}},"jsonrpc":"2.0","id":3}
12:28:42.819562 IP (tos 0x0, ttl 64, id 0, offset 0, flags [DF], proto TCP (6), length 52, bad cksum 0 (->3cc2)!)
    127.0.0.1.3000 > 127.0.0.1.51473: Flags [.], cksum 0xfe28 (incorrect -> 0xccc6), ack 1286, win 6281, options [nop,nop,TS val 84114839 ecr 2908235222], length 0
E..4..@.@.................Wl.........(.....
..}..X%.
12:28:42.819570 IP (tos 0x0, ttl 64, id 0, offset 0, flags [DF], proto TCP (6), length 52, bad cksum 0 (->3cc2)!)
    127.0.0.1.3000 > 127.0.0.1.51473: Flags [.], cksum 0xfe28 (incorrect -> 0xccc6), ack 1286, win 6281, options [nop,nop,TS val 84114839 ecr 2908235222], length 0
E..4..@.@.................Wl.........(.....
..}..X%.
12:28:42.819711 IP (tos 0x0, ttl 64, id 0, offset 0, flags [DF], proto TCP (6), length 186, bad cksum 0 (->3c3c)!)
    127.0.0.1.3000 > 127.0.0.1.51473: Flags [P.], cksum 0xfeae (incorrect -> 0xc963), seq 162:296, ack 1286, win 6281, options [nop,nop,TS val 84114839 ecr 2908235222], length 134
E.....@.@.................Wl...............
..}..X%.HTTP/1.1 202 Accepted
access-control-allow-origin: http://localhost:15000
content-length: 0
date: Mon, 25 Aug 2025 19:28:42 GMT


12:28:42.819726 IP (tos 0x0, ttl 64, id 0, offset 0, flags [DF], proto TCP (6), length 186, bad cksum 0 (->3c3c)!)
    127.0.0.1.3000 > 127.0.0.1.51473: Flags [P.], cksum 0xfeae (incorrect -> 0xc963), seq 162:296, ack 1286, win 6281, options [nop,nop,TS val 84114839 ecr 2908235222], length 134
E.....@.@.................Wl...............
..}..X%.HTTP/1.1 202 Accepted
access-control-allow-origin: http://localhost:15000
content-length: 0
date: Mon, 25 Aug 2025 19:28:42 GMT


12:28:42.819731 IP (tos 0x0, ttl 64, id 0, offset 0, flags [DF], proto TCP (6), length 52, bad cksum 0 (->3cc2)!)
    127.0.0.1.51473 > 127.0.0.1.3000: Flags [.], cksum 0xfe28 (incorrect -> 0xcbf2), ack 296, win 6358, options [nop,nop,TS val 2908235223 ecr 84114839], length 0
E..4..@.@.....................W......(.....
.X%...}.
12:28:42.819742 IP (tos 0x0, ttl 64, id 0, offset 0, flags [DF], proto TCP (6), length 52, bad cksum 0 (->3cc2)!)
    127.0.0.1.51473 > 127.0.0.1.3000: Flags [.], cksum 0xfe28 (incorrect -> 0xcbf2), ack 296, win 6358, options [nop,nop,TS val 2908235223 ecr 84114839], length 0
E..4..@.@.....................W......(.....
.X%...}.
12:28:42.819839 IP (tos 0x0, ttl 64, id 0, offset 0, flags [DF], proto TCP (6), length 184, bad cksum 0 (->3c3e)!)
    127.0.0.1.3000 > 127.0.0.1.51474: Flags [P.], cksum 0xfeac (incorrect -> 0x92cc), seq 3285362952:3285363084, ack 3614872135, win 6373, options [nop,nop,TS val 3662964071 ecr 1082466639], length 132
E.....@.@....................v.G...........
.Teg@.!O7E
event: message
data: {"jsonrpc":"2.0","id":3,"error":{"code":-32603,"message":"Failed to build request: invalid authority"}}



12:28:42.819859 IP (tos 0x0, ttl 64, id 0, offset 0, flags [DF], proto TCP (6), length 184, bad cksum 0 (->3c3e)!)
    127.0.0.1.3000 > 127.0.0.1.51474: Flags [P.], cksum 0xfeac (incorrect -> 0x92cc), seq 0:132, ack 1, win 6373, options [nop,nop,TS val 3662964071 ecr 1082466639], length 132
E.....@.@....................v.G...........
.Teg@.!O7E
event: message
data: {"jsonrpc":"2.0","id":3,"error":{"code":-32603,"message":"Failed to build request: invalid authority"}}



12:28:42.819866 IP (tos 0x0, ttl 64, id 0, offset 0, flags [DF], proto TCP (6), length 52, bad cksum 0 (->3cc2)!)
    127.0.0.1.51474 > 127.0.0.1.3000: Flags [.], cksum 0xfe28 (incorrect -> 0xb52c), ack 132, win 6202, options [nop,nop,TS val 1082490666 ecr 3662964071], length 0
E..4..@.@................v.G.......:.(.....
@..*.Teg
12:28:42.819869 IP (tos 0x0, ttl 64, id 0, offset 0, flags [DF], proto TCP (6), length 52, bad cksum 0 (->3cc2)!)
    127.0.0.1.51474 > 127.0.0.1.3000: Flags [.], cksum 0xfe28 (incorrect -> 0xb52c), ack 132, win 6202, options [nop,nop,TS val 1082490666 ecr 3662964071], length 0
E..4..@.@................v.G.......:.(.....
@..*.Teg
^C
20 packets captured
131 packets received by filter
0 packets dropped by kernel
```

Configuration:

```yaml
binds:
- port: 3000
  listeners:
  - name: mcp-server
    routes:
    - name: mcp-route
      policies:
        cors:
          allowOrigins:
            - "*"
          allowHeaders:
            - "*"
      backends:
      - mcp:
          targets:
          - name: accounts-api
            openapi:
              schema:
                file: services/accounts/openapi.yaml
              host: localhost
              port: 4001
              path: /
          - name: reviews-api
            openapi:
              schema:
                file: services/reviews/openapi.yaml
              host: localhost
              port: 4002
              path: /
          - name: products-api
            openapi:
              schema:
                file: services/products/openapi.yaml
              host: localhost
              port: 4003
              path: /
          - name: inventory-api
            openapi:
              schema:
                file: services/inventory/openapi.yaml
              host: localhost
              port: 4004
              path: /
```

**Comment by murphye** [comment]
Error from the UI after clicking **Run Tool**. I tried both Safari and Firefox.

<img width="1787" height="1019" alt="Image" src="https://github.com/user-attachments/assets/10592bca-0e4c-451a-8d53-2edd48118abb" />

**Comment by murphye** [comment]
No packets are coming to port 4004 where the actual OpenAPI service is running:

```
sudo tcpdump -vnlA -i any port 4004
tcpdump: data link type PKTAP
tcpdump: listening on any, link-type PKTAP (Apple DLT_PKTAP), snapshot length 524288 bytes
```

**Comment by murphye** [comment]
Backend as seen through the UI. Everything looks correct. All backend are correctly configured but have the same error.

<img width="647" height="394" alt="Image" src="https://github.com/user-attachments/assets/5f87c138-c5a5-44b9-9a66-5f4369c985bb" />

**Comment by murphye** [comment]
I tried MCP Inspector. It has the same problem.

<img width="1800" height="669" alt="Image" src="https://github.com/user-attachments/assets/6605ac12-7291-4e7b-91b1-c5e70a901214" />

**Comment by howardjohn** [comment]
Thanks for the issue! Sorry it went this long. In the [v1.3](https://github.com/agentgateway/agentgateway/releases/tag/v1.3.0) we have rewritten the UI which makes this problem, as far as I can tell, obsolete.
